#118,Goldeen,Tosakintoトサキント,Poissirène,Goldini,콘치,https://www.serebii.net/quest/pokemon/118.png,Water,Goldfish Pokémon,Melee,"2'00"" / 0.6m",33.1lbs / 15kg,Evolves into pokemon #119 at level 33 / ,"Aqua Jet - Water Type - 182 power  - 5 sec. cooldown - The user charges at enemies in front of itself with tremendous speed, dealing damage to them. - Not Exclusive / Flail - Normal Type - 130 power  - 5 sec. cooldown - The user flails about, damaging enemies it hits. - Not Exclusive / Splash - Normal Type - 56 power  - 3 sec. cooldown - The user splashes in place. - Not Exclusive / Surf - Water Type - 127 power  - 5 sec. cooldown - The user creates a wide wave and charges forward on it. Deals damage to enemies caught in the wave. - Not Exclusive / Take Down - Normal Type - 189 power  - 5 sec. cooldown - The user slams into enemies in front of itself with a reckless, full-body charge, damaging all enemies hit by it. The user also takes recoil damage. - Not Exclusive / ",+5% ATK of Water-Type Moves / +15% ATK of Water-Type Moves / +500 ATK,-5% Normal-Type Moves Wait / +100% Resistant to Burned / -20% Water-Type Moves Wait,-10% Electric-Type Damage Taken / -20% Electric-Type Damage Taken / -30% Electric-Type Damage Taken,70,130,35.71,59.52,4.76,71-81 - 131-141 / 121-171 - 181-231 / 171-271 - 231-331 / 371-471 - 431-531,80-90 - 140-150 / 130-180 - 190-240 / 180-280 - 240-340 / 380-480 - 440-540,90-100 - 150-160 / 140-190 - 200-250 / 190-290 - 250-350 / 390-490 - 450-550,100-110 - 160-170 / 150-200 - 210-260 / 200-300 - 260-360 / 400-500 - 460-560,110-120 - 170-180 / 160-210 - 220-270 / 210-310 - 270-370 / 410-510 - 470-570,120-130 - 180-190 / 170-220 - 230-280 / 220-320 - 280-380 / 420-520 - 480-580,130-140 - 190-200 / 180-230 - 240-290 / 230-330 - 290-390 / 430-530 - 490-590,140-150 - 200-210 / 190-240 - 250-300 / 240-340 - 300-400 / 440-540 - 500-600,150-160 - 210-220 / 200-250 - 260-310 / 250-350 - 310-410 / 450-550 - 510-610,160-170 - 220-230 / 210-260 - 270-320 / 260-360 - 320-420 / 460-560 - 520-620,170-180 - 230-240 / 220-270 - 280-330 / 270-370 - 330-430 / 470-570 - 530-630
#119,Seaking,Azumaoアズマオウ,Poissoroy,Golking,왕콘치,https://www.serebii.net/quest/pokemon/119.png,Water,Goldfish Pokémon,Melee,"4'03"" / 1.3m",86.0lbs / 39kg,Evolves into pokemon #119 at level 33 / ,"Agility - Psychic Type - 0 power  - 2 sec. cooldown - The user relaxes and lightens its body, raising its movement speed for a while. - Not Exclusive / Aqua Jet - Water Type - 182 power  - 5 sec. cooldown - The user charges at enemies in front of itself with tremendous speed, dealing damage to them. - Not Exclusive / Bounce - Flying Type - 186 power  - 5 sec. cooldown - The user bounces forward high into the air twice, damaging enemies it hits. - Not Exclusive / Flail - Normal Type - 130 power  - 5 sec. cooldown - The user flails about, damaging enemies it hits. - Not Exclusive / Megahorn - Bug Type - 513 power  - 5 sec. cooldown - Using its tough and impressive horn, the user rams into enemies in front of itself with no letup, dealing huge damage to them. - Not Exclusive / Splash - Normal Type - 56 power  - 3 sec. cooldown - The user splashes in place. - Not Exclusive / Supersonic - Normal Type - 0 power  - 3 sec. cooldown - The user generates odd sound waves from its body, often confusing surrounding enemies. - Not Exclusive / Surf - Water Type - 127 power  - 5 sec. cooldown - The user creates a wide wave and charges forward on it. Deals damage to enemies caught in the wave. - Not Exclusive / Take Down - Normal Type - 189 power  - 5 sec. cooldown - The user slams into enemies in front of itself with a reckless, full-body charge, damaging all enemies hit by it. The user also takes recoil damage. - Not Exclusive / Waterfall - Water Type - 252 power  - 5 sec. cooldown - The user approaches enemies in front of itself and creates a pillar of water beneath them. This deals damage to enemies it hits. - Not Exclusive / ",+5% ATK of Water-Type Moves / +10% ATK of Water-Type Moves / +20% ATK of Water-Type Moves,-5% Normal-Type Moves Wait / +100% Resistant to Burned / -15% Water-Type Moves Wait,-10% Electric-Type Damage Taken / -20% Electric-Type Damage Taken / -30% Electric-Type Damage Taken,350,450,33.33,61.9,4.76,351-361 - 451-461 / 401-451 - 501-551 / 451-551 - 551-651 / 651-751 - 751-851,360-370 - 460-470 / 410-460 - 510-560 / 460-560 - 560-660 / 660-760 - 760-860,370-380 - 470-480 / 420-470 - 520-570 / 470-570 - 570-670 / 670-770 - 770-870,380-390 - 480-490 / 430-480 - 530-580 / 480-580 - 580-680 / 680-780 - 780-880,390-400 - 490-500 / 440-490 - 540-590 / 490-590 - 590-690 / 690-790 - 790-890,400-410 - 500-510 / 450-500 - 550-600 / 500-600 - 600-700 / 700-800 - 800-900,410-420 - 510-520 / 460-510 - 560-610 / 510-610 - 610-710 / 710-810 - 810-910,420-430 - 520-530 / 470-520 - 570-620 / 520-620 - 620-720 / 720-820 - 820-920,430-440 - 530-540 / 480-530 - 580-630 / 530-630 - 630-730 / 730-830 - 830-930,440-450 - 540-550 / 490-540 - 590-640 / 540-640 - 640-740 / 740-840 - 840-940,450-460 - 550-560 / 500-550 - 600-650 / 550-650 - 650-750 / 750-850 - 850-950
#120,Staryu,Hitodemanヒトデマン,Stari,Sterndu,별가사리,https://www.serebii.net/quest/pokemon/120.png,Water,Starshape Pokémon,Range,"2'07"" / 0.8m",76.1lbs / 34.5kg,Evolves into pokemon #121 at level 36 / ,"Flash - Normal Type - 0 power  - 2 sec. cooldown - The user suddenly flashes a bright light at surrounding enemies, often lowering their movement speed. - Not Exclusive / Flash Cannon - Steel Type - 170 power  - 7 sec. cooldown - The user focuses all of its light energy into a single point and fires a beam in front of itself, sometimes raising the amount of damage enemies take. - Not Exclusive / Ice Beam - Ice Type - 133 power  - 7 sec. cooldown - The user fires an icy-cold beam at enemies in front of itself. Deals damage to enemies and sometimes freezes them. - Not Exclusive / Icy Wind - Ice Type - 126 power  - 7 sec. cooldown - The user sends a freezing gust of chilled air at enemies in front of itself, damaging them. Sometimes lowers enemies' movement speed. - Not Exclusive / Twister - Dragon Type - 115 power  - 7 sec. cooldown - The user whips up several tornadoes and sends them out in front of itself, damaging enemies hit by them. - Not Exclusive / ",+30% Movement Speed / +40% Movement Speed / +500 ATK,-5% Water-Type Moves Wait / -15% Water-Type Moves Wait / -20% Water-Type Moves Wait,-5% Ice-Type Moves Wait / -10% Pokémon Size Change / -15% Pokémon Size Change,60,140,30.95,64.29,4.76,61-71 - 141-151 / 111-161 - 191-241 / 161-261 - 241-341 / 361-461 - 441-541,70-80 - 150-160 / 120-170 - 200-250 / 170-270 - 250-350 / 370-470 - 450-550,80-90 - 160-170 / 130-180 - 210-260 / 180-280 - 260-360 / 380-480 - 460-560,90-100 - 170-180 / 140-190 - 220-270 / 190-290 - 270-370 / 390-490 - 470-570,100-110 - 180-190 / 150-200 - 230-280 / 200-300 - 280-380 / 400-500 - 480-580,110-120 - 190-200 / 160-210 - 240-290 / 210-310 - 290-390 / 410-510 - 490-590,120-130 - 200-210 / 170-220 - 250-300 / 220-320 - 300-400 / 420-520 - 500-600,130-140 - 210-220 / 180-230 - 260-310 / 230-330 - 310-410 / 430-530 - 510-610,140-150 - 220-230 / 190-240 - 270-320 / 240-340 - 320-420 / 440-540 - 520-620,150-160 - 230-240 / 200-250 - 280-330 / 250-350 - 330-430 / 450-550 - 530-630,160-170 - 240-250 / 210-260 - 290-340 / 260-360 - 340-440 / 460-560 - 540-640
#121,Starmie,Starmieスターミー,Staross,Starmie,아쿠스타,https://www.serebii.net/quest/pokemon/121.png,Water / Psychic,Mysterious Pokémon,Range,"3'07"" / 1.1m",176.4lbs / 80kg,Evolves into pokemon #121 at level 36 / ,"Blizzard - Ice Type - 52 power  - 5 sec. cooldown - The user moves about while creating a blizzard centered on itself. Deals damage to enemies around the user and sometimes freezes them. - Not Exclusive / Confuse Ray - Ghost Type - 0 power  - 3 sec. cooldown - The user exposes surrounding enemies to a sinister ray, often confusing them. - Not Exclusive / Flash - Normal Type - 0 power  - 2 sec. cooldown - The user suddenly flashes a bright light at surrounding enemies, often lowering their movement speed. - Not Exclusive / Flash Cannon - Steel Type - 170 power  - 7 sec. cooldown - The user focuses all of its light energy into a single point and fires a beam in front of itself, sometimes raising the amount of damage enemies take. - Not Exclusive / Hydro Pump - Water Type - 213 power  - 5 sec. cooldown - The user shoots four pillars of water up from the ground and sends them out in front of itself. Deals damage to enemies hit by them. - Not Exclusive / Hyper Beam - Normal Type - 300 power  - 10 sec. cooldown - The user stores up power and then fires a tremendous beam at enemies. Deals severe damage to enemies it hits. - Not Exclusive / Ice Beam - Ice Type - 133 power  - 7 sec. cooldown - The user fires an icy-cold beam at enemies in front of itself. Deals damage to enemies and sometimes freezes them. - Not Exclusive / Icy Wind - Ice Type - 126 power  - 7 sec. cooldown - The user sends a freezing gust of chilled air at enemies in front of itself, damaging them. Sometimes lowers enemies' movement speed. - Not Exclusive / Psychic - Psychic Type - 121 power  - 7 sec. cooldown - The user creates a large, mysterious light and fires it out, dealing damage to enemies hit by it. Sometimes raises the amount of damage they take. - Not Exclusive / Twister - Dragon Type - 115 power  - 7 sec. cooldown - The user whips up several tornadoes and sends them out in front of itself, damaging enemies hit by them. - Not Exclusive / ",+30% Movement Speed / +15% Movement Speed / +30% ATK of Water-Type Moves,-5% Water-Type Moves Wait / -10% Water-Type Moves Wait / -15% Water-Type Moves Wait,-5% Ice-Type Moves Wait / -10% Pokémon Size Change / -15% Pokémon Size Change,150,650,28.57,66.67,4.76,151-161 - 651-661 / 201-251 - 701-751 / 251-351 - 751-851 / 451-551 - 951-1051,160-170 - 660-670 / 210-260 - 710-760 / 260-360 - 760-860 / 460-560 - 960-1060,170-180 - 670-680 / 220-270 - 720-770 / 270-370 - 770-870 / 470-570 - 970-1070,180-190 - 680-690 / 230-280 - 730-780 / 280-380 - 780-880 / 480-580 - 980-1080,190-200 - 690-700 / 240-290 - 740-790 / 290-390 - 790-890 / 490-590 - 990-1090,200-210 - 700-710 / 250-300 - 750-800 / 300-400 - 800-900 / 500-600 - 1000-1100,210-220 - 710-720 / 260-310 - 760-810 / 310-410 - 810-910 / 510-610 - 1010-1110,220-230 - 720-730 / 270-320 - 770-820 / 320-420 - 820-920 / 520-620 - 1020-1120,230-240 - 730-740 / 280-330 - 780-830 / 330-430 - 830-930 / 530-630 - 1030-1130,240-250 - 740-750 / 290-340 - 790-840 / 340-440 - 840-940 / 540-640 - 1040-1140,250-260 - 750-760 / 300-350 - 800-850 / 350-450 - 850-950 / 550-650 - 1050-1150
#122,Mr. Mime,Barrierdバリヤード,M. Mime,Pantimos,마임맨,https://www.serebii.net/quest/pokemon/122.png,Psychic / Fairy,Barrier Pokémon,Range,"4'03"" / 1.3m",120.2lbs / 54.5kg,,"Barrier - Psychic Type - 0 power  - 5 sec. cooldown - The user throws up a wall around itself, lowering the amount of damage it takes for a while. - Not Exclusive / Charm - Fairy Type - 0 power  - 3 sec. cooldown - The user makes surrounding enemies less wary with its cute behavior, often reducing the amount of damage they deal. - Not Exclusive / Follow Me - Normal Type - 0 power  - 2 sec. cooldown - The user grabs the attention of surrounding enemies, forcing them to target it. - Not Exclusive / Hypnosis - Psychic Type - 0 power  - 5 sec. cooldown - The user employs hypnotic suggestion, often making enemies in front of itself fall asleep. - Not Exclusive / Light Screen - Psychic Type - 0 power  - 3 sec. cooldown - The user creates a wall of light, making it harder for it to be affected by negative effects for a while. - Not Exclusive / Meditate - Psychic Type - 0 power  - 5 sec. cooldown - The user meditates to awaken the power deep within its body, raising the amount of damage it deals for a while. - Not Exclusive / Nasty Plot - Dark Type - 0 power  - 5 sec. cooldown - The user stimulates its brain by thinking bad thoughts, raising the amount of damage it deals for a while. - Not Exclusive / Psychic - Psychic Type - 121 power  - 7 sec. cooldown - The user creates a large, mysterious light and fires it out, dealing damage to enemies hit by it. Sometimes raises the amount of damage they take. - Not Exclusive / Substitute - Normal Type - 0 power  - 5 sec. cooldown - The user puts out a substitute for itself that enemies are forced to attack. - Not Exclusive / Taunt - Dark Type - 0 power  - 2 sec. cooldown - The user taunts surrounding enemies, forcing them to target it. - Not Exclusive / ",+15% ATK of Psychic-Type Moves / +20% ATK of Psychic-Type Moves / +500 ATK,+10% Resistant to ↓ Effects / +20% Resistant to ↓ Effects / -50% Dragon-Type Damage Taken,-5% Psychic-Type Moves Wait / -10% Psychic-Type Moves Wait / -15% Psychic-Type Moves Wait,575,125,61.9,33.33,4.76,576-586 - 126-136 / 626-676 - 176-226 / 676-776 - 226-326 / 876-976 - 426-526,585-595 - 135-145 / 635-685 - 185-235 / 685-785 - 235-335 / 885-985 - 435-535,595-605 - 145-155 / 645-695 - 195-245 / 695-795 - 245-345 / 895-995 - 445-545,605-615 - 155-165 / 655-705 - 205-255 / 705-805 - 255-355 / 905-1005 - 455-555,615-625 - 165-175 / 665-715 - 215-265 / 715-815 - 265-365 / 915-1015 - 465-565,625-635 - 175-185 / 675-725 - 225-275 / 725-825 - 275-375 / 925-1025 - 475-575,635-645 - 185-195 / 685-735 - 235-285 / 735-835 - 285-385 / 935-1035 - 485-585,645-655 - 195-205 / 695-745 - 245-295 / 745-845 - 295-395 / 945-1045 - 495-595,655-665 - 205-215 / 705-755 - 255-305 / 755-855 - 305-405 / 955-1055 - 505-605,665-675 - 215-225 / 715-765 - 265-315 / 765-865 - 315-415 / 965-1065 - 515-615,675-685 - 225-235 / 725-775 - 275-325 / 775-875 - 325-425 / 975-1075 - 525-625
#123,Scyther,Strikeストライク,Insécateur,Sichlor,스라크,https://www.serebii.net/quest/pokemon/123.png,Bug / Flying,Mantis Pokémon,Melee,"4'11"" / 1.5m",123.5lbs / 56kg,,"Aerial Ace - Flying Type - 124 power  - 5 sec. cooldown - The user quickly slashes in front of itself twice, dealing damage. - Not Exclusive / Agility - Psychic Type - 0 power  - 2 sec. cooldown - The user relaxes and lightens its body, raising its movement speed for a while. - Not Exclusive / Lunge - Bug Type - 180 power  - 5 sec. cooldown - The user lunges toward enemies in front of itself, damaging them. - Not Exclusive / Night Slash - Dark Type - 83 power  - 5 sec. cooldown - The user dashes forward, slashing surrounding enemies and damaging them. Critical hits land more easily. - Not Exclusive / Rock Smash - Fighting Type - 29 power  - 1 sec. cooldown - The user unleashes its fury, damaging enemies in a broad area nearby and destroying surrounding trees and rocks. - Not Exclusive / Silver Wind - Bug Type - 53 power  - 5 sec. cooldown - Scales carried by the wind swirl around the user, damaging enemies hit by them. Some or all of the user's stats sometimes rise at random. - Not Exclusive / Steel Wing - Steel Type - 81 power  - 5 sec. cooldown - The user charges at enemies in front of itself and smacks them with its hard wings, dealing damage. Sometimes reduces the amount of damage the user takes. - Not Exclusive / Swords Dance - Normal Type - 0 power  - 5 sec. cooldown - With a frenetic dance to uplift the fighting spirit, the user raises the amount of damage it deals for a while. - Not Exclusive / Tailwind - Flying Type - 0 power  - 2 sec. cooldown - The user creates an intense swirling wind that raises its movement speed for a while. - Not Exclusive / U-turn - Bug Type - 243 power  - 5 sec. cooldown - After attacking surrounding enemies, the user moves back to dodge enemies' counterattacks. - Not Exclusive / ",+5% ATK of Bug-Type Moves / +15% ATK of Bug-Type Moves / +20% ATK of Bug-Type Moves,+30% Movement Speed / +40% Movement Speed / +50% Movement Speed,-5% Bug-Type Moves Wait / -10% Bug-Type Moves Wait / -15% Bug-Type Moves Wait,100,700,22.73,68.18,9.09,101-111 - 701-711 / 151-201 - 751-801 / 201-301 - 801-901 / 401-501 - 1001-1101,110-120 - 710-720 / 160-210 - 760-810 / 210-310 - 810-910 / 410-510 - 1010-1110,120-130 - 720-730 / 170-220 - 770-820 / 220-320 - 820-920 / 420-520 - 1020-1120,130-140 - 730-740 / 180-230 - 780-830 / 230-330 - 830-930 / 430-530 - 1030-1130,140-150 - 740-750 / 190-240 - 790-840 / 240-340 - 840-940 / 440-540 - 1040-1140,150-160 - 750-760 / 200-250 - 800-850 / 250-350 - 850-950 / 450-550 - 1050-1150,160-170 - 760-770 / 210-260 - 810-860 / 260-360 - 860-960 / 460-560 - 1060-1160,170-180 - 770-780 / 220-270 - 820-870 / 270-370 - 870-970 / 470-570 - 1070-1170,180-190 - 780-790 / 230-280 - 830-880 / 280-380 - 880-980 / 480-580 - 1080-1180,190-200 - 790-800 / 240-290 - 840-890 / 290-390 - 890-990 / 490-590 - 1090-1190,200-210 - 800-810 / 250-300 - 850-900 / 300-400 - 900-1000 / 500-600 - 1100-1200
#124,Jynx,Rougelaルージュラ,Lippoutou,Rossana,루주라,https://www.serebii.net/quest/pokemon/124.png,Ice / Psychic,Humanshape Pokémon,Range,"4'07"" / 1.4m",89.5lbs / 40.6kg,,"Aurora Veil - Ice Type - 0 power  - 7 sec. cooldown - The user cloaks itself in a veil of light, reducing the amount of damage it takes for a while. - Not Exclusive / Blizzard - Ice Type - 52 power  - 5 sec. cooldown - The user moves about while creating a blizzard centered on itself. Deals damage to enemies around the user and sometimes freezes them. - Not Exclusive / Draining Kiss - Fairy Type - 165 power  - 9 sec. cooldown - The user kisses enemies directly in front of itself and damages them. Part of the damage dealt restores the user's HP. - Not Exclusive / Flash - Normal Type - 0 power  - 2 sec. cooldown - The user suddenly flashes a bright light at surrounding enemies, often lowering their movement speed. - Not Exclusive / Ice Beam - Ice Type - 133 power  - 7 sec. cooldown - The user fires an icy-cold beam at enemies in front of itself. Deals damage to enemies and sometimes freezes them. - Not Exclusive / Meditate - Psychic Type - 0 power  - 5 sec. cooldown - The user meditates to awaken the power deep within its body, raising the amount of damage it deals for a while. - Not Exclusive / Psybeam - Psychic Type - 69 power  - 7 sec. cooldown - The user sends peculiar rays of light out in three directions, damaging enemies hit by them. Sometimes confuses enemies. - Not Exclusive / Psychic - Psychic Type - 121 power  - 7 sec. cooldown - The user creates a large, mysterious light and fires it out, dealing damage to enemies hit by it. Sometimes raises the amount of damage they take. - Not Exclusive / Sing - Normal Type - 0 power  - 3 sec. cooldown - The user sings to enemies around itself with its calming voice, often putting them to sleep. - Not Exclusive / Sweet Kiss - Fairy Type - 165 power  - 3 sec. cooldown - The user kisses enemies directly in front of itself with a sweet, angelic kiss that often confuses them. - Not Exclusive / ",-5% Psychic-Type Moves Wait / +15% ATK of Psychic-Type Moves / +20% ATK of Psychic-Type Moves,-5% Fairy-Type Moves Wait / +100% Resistant to Frozen / -50% Water-Type Damage Taken,-5% Ice-Type Moves Wait / +15% ATK of Ice-Type Moves / +20% ATK of Ice-Type Moves,150,550,30.95,64.29,4.76,151-161 - 551-561 / 201-251 - 601-651 / 251-351 - 651-751 / 451-551 - 851-951,160-170 - 560-570 / 210-260 - 610-660 / 260-360 - 660-760 / 460-560 - 860-960,170-180 - 570-580 / 220-270 - 620-670 / 270-370 - 670-770 / 470-570 - 870-970,180-190 - 580-590 / 230-280 - 630-680 / 280-380 - 680-780 / 480-580 - 880-980,190-200 - 590-600 / 240-290 - 640-690 / 290-390 - 690-790 / 490-590 - 890-990,200-210 - 600-610 / 250-300 - 650-700 / 300-400 - 700-800 / 500-600 - 900-1000,210-220 - 610-620 / 260-310 - 660-710 / 310-410 - 710-810 / 510-610 - 910-1010,220-230 - 620-630 / 270-320 - 670-720 / 320-420 - 720-820 / 520-620 - 920-1020,230-240 - 630-640 / 280-330 - 680-730 / 330-430 - 730-830 / 530-630 - 930-1030,240-250 - 640-650 / 290-340 - 690-740 / 340-440 - 740-840 / 540-640 - 940-1040,250-260 - 650-660 / 300-350 - 700-750 / 350-450 - 750-850 / 550-650 - 950-1050
#125,Electabuzz,Elebooエレブー,Élektek,Elektek,에레브,https://www.serebii.net/quest/pokemon/125.png,Electric,Electric Pokémon,Melee,"3'07"" / 1.1m",66.1lbs / 30kg,,"Charge - Electric Type - 0 power  - 9 sec. cooldown - The user stores up electricity, raising the damage it deals and making it resistant to negative effects for a while. - Not Exclusive / Cross Chop - Fighting Type - 273 power  - 5 sec. cooldown - The user jumps toward enemies in front of itself and smacks them with a two-handed chop, damaging them. Critical hits land more easily. - Not Exclusive / Dynamic Punch - Fighting Type - 87 power  - 5 sec. cooldown - The user punches enemies directly in front of itself with its full, concentrated power. Sometimes confuses enemies. - Not Exclusive / Electroweb - Electric Type - 0 power  - 2 sec. cooldown - The user spreads an electric net out directly in front of itself, lowering the movement speed of enemies hit by it for a while. - Not Exclusive / Meditate - Psychic Type - 0 power  - 5 sec. cooldown - The user meditates to awaken the power deep within its body, raising the amount of damage it deals for a while. - Not Exclusive / Power-Up Punch - Fighting Type - 64 power  - 5 sec. cooldown - The user delivers a punch with its hard fist to enemies directly in front of itself, damaging them. Often raises the amount of damage the user deals. - Not Exclusive / Thunder - Electric Type - 204 power  - 5 sec. cooldown - The user strikes the area in front of itself with a lightning bolt. Deals damage to nearby enemies. Sometimes paralyzes enemies. - Not Exclusive / Thunder Punch - Electric Type - 194 power  - 5 sec. cooldown - The user charges its fist with electricity and unleashes a shocking punch on enemies directly in front of itself, sometimes paralyzing them. - Not Exclusive / Thunder Shock - Electric Type - 173 power  - 5 sec. cooldown - After storing up electricity, the user fires it toward enemies in front of itself, dealing damage to them. Sometimes paralyzes enemies. - Not Exclusive / Thunderbolt - Electric Type - 80 power  - 5 sec. cooldown - The user discharges tremendous electricity all around itself. Deals damage to enemies around the user. Sometimes paralyzes enemies. - Not Exclusive / ",+5% ATK of Electric-Type Moves / +15% ATK of Electric-Type Moves / +20% ATK of Electric-Type Moves,+5% ATK of Fighting-Type Moves / +100% Resistant to Paralyzed / +100% Resistant to Asleep,-5% Electric-Type Moves Wait / -10% Electric-Type Moves Wait / -15% Electric-Type Moves Wait,300,400,42.86,52.38,4.76,301-311 - 401-411 / 351-401 - 451-501 / 401-501 - 501-601 / 601-701 - 701-801,310-320 - 410-420 / 360-410 - 460-510 / 410-510 - 510-610 / 610-710 - 710-810,320-330 - 420-430 / 370-420 - 470-520 / 420-520 - 520-620 / 620-720 - 720-820,330-340 - 430-440 / 380-430 - 480-530 / 430-530 - 530-630 / 630-730 - 730-830,340-350 - 440-450 / 390-440 - 490-540 / 440-540 - 540-640 / 640-740 - 740-840,350-360 - 450-460 / 400-450 - 500-550 / 450-550 - 550-650 / 650-750 - 750-850,360-370 - 460-470 / 410-460 - 510-560 / 460-560 - 560-660 / 660-760 - 760-860,370-380 - 470-480 / 420-470 - 520-570 / 470-570 - 570-670 / 670-770 - 770-870,380-390 - 480-490 / 430-480 - 530-580 / 480-580 - 580-680 / 680-780 - 780-880,390-400 - 490-500 / 440-490 - 540-590 / 490-590 - 590-690 / 690-790 - 790-890,400-410 - 500-510 / 450-500 - 550-600 / 500-600 - 600-700 / 700-800 - 800-900
