#074,Geodude,Isitsubuteイシツブテ,Racaillou,Kleinstein,꼬마돌,https://www.serebii.net/quest/pokemon/074.png,Rock / Ground,Rock Pokémon,Melee,"1'04"" / 0.4m",44.1lbs / 20kg,Evolves into pokemon #075 at level 25 / Evolves into pokemon #076 at level 36 / ,"Dig - Ground Type - 243 power  - 5 sec. cooldown - The user digs a tunnel to travel beneath the feet of enemies in front of itself, then pops out from beneath them to damage them. - Not Exclusive / Flail - Normal Type - 130 power  - 5 sec. cooldown - The user flails about, damaging enemies it hits. - Not Exclusive / Harden - Normal Type - 0 power  - 5 sec. cooldown - The user stiffens all the muscles in its body, lowering the damage it takes for a while. - Not Exclusive / Tackle - Normal Type - 163 power  - 5 sec. cooldown - The user smashes into enemies in front of itself with all its might, damaging them. - Not Exclusive / ",+5% ATK of Ground-Type Moves / +20% ATK of Ground-Type Moves / +25% ATK of Ground-Type Moves,+5% ATK of Normal-Type Moves / +20% ATK of Normal-Type Moves / +550 HP,-10% Own Knockback Distance / -20% Own Knockback Distance / -30% Own Knockback Distance,140,60,61.9,33.33,4.76,141-151 - 61-71 / 191-241 - 111-161 / 241-341 - 161-261 / 441-541 - 361-461,150-160 - 70-80 / 200-250 - 120-170 / 250-350 - 170-270 / 450-550 - 370-470,160-170 - 80-90 / 210-260 - 130-180 / 260-360 - 180-280 / 460-560 - 380-480,170-180 - 90-100 / 220-270 - 140-190 / 270-370 - 190-290 / 470-570 - 390-490,180-190 - 100-110 / 230-280 - 150-200 / 280-380 - 200-300 / 480-580 - 400-500,190-200 - 110-120 / 240-290 - 160-210 / 290-390 - 210-310 / 490-590 - 410-510,200-210 - 120-130 / 250-300 - 170-220 / 300-400 - 220-320 / 500-600 - 420-520,210-220 - 130-140 / 260-310 - 180-230 / 310-410 - 230-330 / 510-610 - 430-530,220-230 - 140-150 / 270-320 - 190-240 / 320-420 - 240-340 / 520-620 - 440-540,230-240 - 150-160 / 280-330 - 200-250 / 330-430 - 250-350 / 530-630 - 450-550,240-250 - 160-170 / 290-340 - 210-260 / 340-440 - 260-360 / 540-640 - 460-560
#075,Graveler,Goloneゴローン,Gravalanch,Georok,데구리,https://www.serebii.net/quest/pokemon/075.png,Rock / Ground,Rock Pokémon,Melee,"3'03"" / 1m",231.5lbs / 105kg,Evolves into pokemon #075 at level 25 / Evolves into pokemon #076 at level 36 / ,"Dig - Ground Type - 243 power  - 5 sec. cooldown - The user digs a tunnel to travel beneath the feet of enemies in front of itself, then pops out from beneath them to damage them. - Not Exclusive / Flail - Normal Type - 130 power  - 5 sec. cooldown - The user flails about, damaging enemies it hits. - Not Exclusive / Harden - Normal Type - 0 power  - 5 sec. cooldown - The user stiffens all the muscles in its body, lowering the damage it takes for a while. - Not Exclusive / Rollout - Rock Type - 130 power  - 5 sec. cooldown - The user spins around, damaging surrounding enemies it smashes into. - Not Exclusive / Self-Destruct - Normal Type - 494 power  - 5 sec. cooldown - The user approaches enemies and causes an explosion, damaging all surrounding enemies. The trade-off is that the user takes enough damage to knock itself out. - Not Exclusive / Stealth Rock - Rock Type - 120 power  - 5 sec. cooldown - The user creates pillars of stone from the ground, damaging enemies hit by them. - Not Exclusive / Tackle - Normal Type - 163 power  - 5 sec. cooldown - The user smashes into enemies in front of itself with all its might, damaging them. - Not Exclusive / ",+5% ATK of Ground-Type Moves / +15% ATK of Ground-Type Moves / +20% ATK of Ground-Type Moves,+5% ATK of Normal-Type Moves / +15% ATK of Normal-Type Moves / +450 ATK,-10% Own Knockback Distance / +20% Critical Hit Damage / -30% Own Knockback Distance,610,90,64.29,30.95,4.76,611-621 - 91-101 / 661-711 - 141-191 / 711-811 - 191-291 / 911-1011 - 391-491,620-630 - 100-110 / 670-720 - 150-200 / 720-820 - 200-300 / 920-1020 - 400-500,630-640 - 110-120 / 680-730 - 160-210 / 730-830 - 210-310 / 930-1030 - 410-510,640-650 - 120-130 / 690-740 - 170-220 / 740-840 - 220-320 / 940-1040 - 420-520,650-660 - 130-140 / 700-750 - 180-230 / 750-850 - 230-330 / 950-1050 - 430-530,660-670 - 140-150 / 710-760 - 190-240 / 760-860 - 240-340 / 960-1060 - 440-540,670-680 - 150-160 / 720-770 - 200-250 / 770-870 - 250-350 / 970-1070 - 450-550,680-690 - 160-170 / 730-780 - 210-260 / 780-880 - 260-360 / 980-1080 - 460-560,690-700 - 170-180 / 740-790 - 220-270 / 790-890 - 270-370 / 990-1090 - 470-570,700-710 - 180-190 / 750-800 - 230-280 / 800-900 - 280-380 / 1000-1100 - 480-580,710-720 - 190-200 / 760-810 - 240-290 / 810-910 - 290-390 / 1010-1110 - 490-590
#076,Golem,Golonyaゴローニャ,Grolem,Geowaz,딱구리,https://www.serebii.net/quest/pokemon/076.png,Rock / Ground,Megaton Pokémon,Melee,"4'07"" / 1.4m",661.4lbs / 300kg,Evolves into pokemon #075 at level 25 / Evolves into pokemon #076 at level 36 / ,"Dig - Ground Type - 243 power  - 5 sec. cooldown - The user digs a tunnel to travel beneath the feet of enemies in front of itself, then pops out from beneath them to damage them. - Not Exclusive / Earthquake - Ground Type - 390 power  - 5 sec. cooldown - The user causes an earthquake that damages surrounding enemies. - Not Exclusive / Explosion - Normal Type - 683 power  - 5 sec. cooldown - The user causes a tremendous explosion, dealing huge damage to surrounding enemies. The trade-off is that the user takes enough damage to knock itself out. - Not Exclusive / Flail - Normal Type - 130 power  - 5 sec. cooldown - The user flails about, damaging enemies it hits. - Not Exclusive / Harden - Normal Type - 0 power  - 5 sec. cooldown - The user stiffens all the muscles in its body, lowering the damage it takes for a while. - Not Exclusive / Rock Polish - Rock Type - 0 power  - 2 sec. cooldown - The user polishes its body to reduce drag, raising its movement speed for a while. - Not Exclusive / Rollout - Rock Type - 130 power  - 5 sec. cooldown - The user spins around, damaging surrounding enemies it smashes into. - Not Exclusive / Self-Destruct - Normal Type - 494 power  - 5 sec. cooldown - The user approaches enemies and causes an explosion, damaging all surrounding enemies. The trade-off is that the user takes enough damage to knock itself out. - Not Exclusive / Stealth Rock - Rock Type - 120 power  - 5 sec. cooldown - The user creates pillars of stone from the ground, damaging enemies hit by them. - Not Exclusive / Tackle - Normal Type - 163 power  - 5 sec. cooldown - The user smashes into enemies in front of itself with all its might, damaging them. - Not Exclusive / ",+5% ATK of Ground-Type Moves / +10% ATK of Ground-Type Moves / +15% ATK of Ground-Type Moves,+5% ATK of Normal-Type Moves / +10% ATK of Normal-Type Moves / +20% ATK of Normal-Type Moves,-10% Own Knockback Distance / +20% Critical Hit Damage / -30% Own Knockback Distance,700,100,63.64,27.27,9.09,701-711 - 101-111 / 751-801 - 151-201 / 801-901 - 201-301 / 1001-1101 - 401-501,710-720 - 110-120 / 760-810 - 160-210 / 810-910 - 210-310 / 1010-1110 - 410-510,720-730 - 120-130 / 770-820 - 170-220 / 820-920 - 220-320 / 1020-1120 - 420-520,730-740 - 130-140 / 780-830 - 180-230 / 830-930 - 230-330 / 1030-1130 - 430-530,740-750 - 140-150 / 790-840 - 190-240 / 840-940 - 240-340 / 1040-1140 - 440-540,750-760 - 150-160 / 800-850 - 200-250 / 850-950 - 250-350 / 1050-1150 - 450-550,760-770 - 160-170 / 810-860 - 210-260 / 860-960 - 260-360 / 1060-1160 - 460-560,770-780 - 170-180 / 820-870 - 220-270 / 870-970 - 270-370 / 1070-1170 - 470-570,780-790 - 180-190 / 830-880 - 230-280 / 880-980 - 280-380 / 1080-1180 - 480-580,790-800 - 190-200 / 840-890 - 240-290 / 890-990 - 290-390 / 1090-1190 - 490-590,800-810 - 200-210 / 850-900 - 250-300 / 900-1000 - 300-400 / 1100-1200 - 500-600
#077,Ponyta,Ponytaポニータ,Ponyta,Ponita,포니타,https://www.serebii.net/quest/pokemon/077.png,Fire,Fire Horse Pokémon,Melee,"3'03"" / 1m",66.1lbs / 30kg,Evolves into pokemon #078 at level 40 / ,"Agility - Psychic Type - 0 power  - 2 sec. cooldown - The user relaxes and lightens its body, raising its movement speed for a while. - Not Exclusive / Bounce - Flying Type - 186 power  - 5 sec. cooldown - The user bounces forward high into the air twice, damaging enemies it hits. - Not Exclusive / Fire Spin - Fire Type - 97 power  - 5 sec. cooldown - The user creates flames all around itself and fires them off in a spiral. Deals damage to enemies they hit. Sometimes burns enemies. - Not Exclusive / Flame Charge - Fire Type - 0 power  - 5 sec. cooldown - The user stores up the power of flames, raising the damage it deals for a while. - Not Exclusive / Stomp - Normal Type - 180 power  - 5 sec. cooldown - The user stomps on enemies in front of itself with a big foot, damaging them. - Not Exclusive / ",+30% Movement Speed / +40% Movement Speed / -50% Fire-Type Damage Taken,+5% ATK of Fire-Type Moves / +100% Resistant to Burned / +500 ATK,-5% Fire-Type Moves Wait / -15% Fire-Type Moves Wait / -20% Fire-Type Moves Wait,100,100,47.62,47.62,4.76,101-111 - 101-111 / 151-201 - 151-201 / 201-301 - 201-301 / 401-501 - 401-501,110-120 - 110-120 / 160-210 - 160-210 / 210-310 - 210-310 / 410-510 - 410-510,120-130 - 120-130 / 170-220 - 170-220 / 220-320 - 220-320 / 420-520 - 420-520,130-140 - 130-140 / 180-230 - 180-230 / 230-330 - 230-330 / 430-530 - 430-530,140-150 - 140-150 / 190-240 - 190-240 / 240-340 - 240-340 / 440-540 - 440-540,150-160 - 150-160 / 200-250 - 200-250 / 250-350 - 250-350 / 450-550 - 450-550,160-170 - 160-170 / 210-260 - 210-260 / 260-360 - 260-360 / 460-560 - 460-560,170-180 - 170-180 / 220-270 - 220-270 / 270-370 - 270-370 / 470-570 - 470-570,180-190 - 180-190 / 230-280 - 230-280 / 280-380 - 280-380 / 480-580 - 480-580,190-200 - 190-200 / 240-290 - 240-290 / 290-390 - 290-390 / 490-590 - 490-590,200-210 - 200-210 / 250-300 - 250-300 / 300-400 - 300-400 / 500-600 - 500-600
#078,Rapidash,Gallopギャロップ,Galopa,Gallopa,날쌩마,https://www.serebii.net/quest/pokemon/078.png,Fire,Fire Horse Pokémon,Melee,"5'07"" / 1.7m",209.4lbs / 95kg,Evolves into pokemon #078 at level 40 / ,"Agility - Psychic Type - 0 power  - 2 sec. cooldown - The user relaxes and lightens its body, raising its movement speed for a while. - Not Exclusive / Bounce - Flying Type - 186 power  - 5 sec. cooldown - The user bounces forward high into the air twice, damaging enemies it hits. - Not Exclusive / Fire Blast - Fire Type - 179 power  - 5 sec. cooldown - The user sprays an all-consuming fire on the ground, damaging enemies hit by it and sometimes burning them. - Not Exclusive / Fire Spin - Fire Type - 97 power  - 5 sec. cooldown - The user creates flames all around itself and fires them off in a spiral. Deals damage to enemies they hit. Sometimes burns enemies. - Not Exclusive / Flame Charge - Fire Type - 0 power  - 5 sec. cooldown - The user stores up the power of flames, raising the damage it deals for a while. - Not Exclusive / Flame Wheel - Fire Type - 57 power  - 5 sec. cooldown - The user cloaks itself in fire and charges forward, damaging enemies it hits and sometimes burning them. - Not Exclusive / Flare Blitz - Fire Type - 128 power  - 5 sec. cooldown - The user creates a path of flames in front of itself and charges forward along it. Deals damage to enemies. Sometimes burns enemies. - Not Exclusive / Megahorn - Bug Type - 513 power  - 5 sec. cooldown - Using its tough and impressive horn, the user rams into enemies in front of itself with no letup, dealing huge damage to them. - Not Exclusive / Stomp - Normal Type - 180 power  - 5 sec. cooldown - The user stomps on enemies in front of itself with a big foot, damaging them. - Not Exclusive / Will-O-Wisp - Fire Type - 19 power  - 3 sec. cooldown - The user drapes itself with sinister flames and attacks enemies directly in front of it. Often burns enemies. - Not Exclusive / ",+30% Movement Speed / +40% Movement Speed / -50% Fire-Type Damage Taken,+5% ATK of Fire-Type Moves / +100% Resistant to Burned / +25% ATK of Fire-Type Moves,-5% Fire-Type Moves Wait / -10% Fire-Type Moves Wait / -15% Fire-Type Moves Wait,400,400,47.62,47.62,4.76,401-411 - 401-411 / 451-501 - 451-501 / 501-601 - 501-601 / 701-801 - 701-801,410-420 - 410-420 / 460-510 - 460-510 / 510-610 - 510-610 / 710-810 - 710-810,420-430 - 420-430 / 470-520 - 470-520 / 520-620 - 520-620 / 720-820 - 720-820,430-440 - 430-440 / 480-530 - 480-530 / 530-630 - 530-630 / 730-830 - 730-830,440-450 - 440-450 / 490-540 - 490-540 / 540-640 - 540-640 / 740-840 - 740-840,450-460 - 450-460 / 500-550 - 500-550 / 550-650 - 550-650 / 750-850 - 750-850,460-470 - 460-470 / 510-560 - 510-560 / 560-660 - 560-660 / 760-860 - 760-860,470-480 - 470-480 / 520-570 - 520-570 / 570-670 - 570-670 / 770-870 - 770-870,480-490 - 480-490 / 530-580 - 530-580 / 580-680 - 580-680 / 780-880 - 780-880,490-500 - 490-500 / 540-590 - 540-590 / 590-690 - 590-690 / 790-890 - 790-890,500-510 - 500-510 / 550-600 - 550-600 / 600-700 - 600-700 / 800-900 - 800-900
#079,Slowpoke,Yadonヤドン,Ramoloss,Flegmon,야돈,https://www.serebii.net/quest/pokemon/079.png,Water / Psychic,Dopey Pokémon,Melee,"3'11"" / 1.2m",79.4lbs / 36kg,Evolves into pokemon #080 at level 37 / ,"Growl - Normal Type - 0 power  - 4 sec. cooldown - The user growls in an endearing way, making surrounding enemies less wary and often reducing the amount of damage they deal. - Not Exclusive / Ice Punch - Ice Type - 175 power  - 5 sec. cooldown - The user chills its fist and unleashes a freezing punch on enemies directly in front of it. Sometimes freezes enemies. - Not Exclusive / Light Screen - Psychic Type - 0 power  - 3 sec. cooldown - The user creates a wall of light, making it harder for it to be affected by negative effects for a while. - Not Exclusive / Tackle - Normal Type - 163 power  - 5 sec. cooldown - The user smashes into enemies in front of itself with all its might, damaging them. - Not Exclusive / Zen Headbutt - Psychic Type - 370 power  - 5 sec. cooldown - The user focuses its willpower to its head, then smashes it into enemies directly in front of itself, dealing damage to enemies hit by it. - Not Exclusive / ",+100 HP / +200 HP / +350 HP,+30% Healing per Wave / +100% Resistant to Confused / +40% Healing per Wave,-10% Time to Recover / +10% HP upon Recovery / -20% Time to Recover,130,70,59.52,35.71,4.76,131-141 - 71-81 / 181-231 - 121-171 / 231-331 - 171-271 / 431-531 - 371-471,140-150 - 80-90 / 190-240 - 130-180 / 240-340 - 180-280 / 440-540 - 380-480,150-160 - 90-100 / 200-250 - 140-190 / 250-350 - 190-290 / 450-550 - 390-490,160-170 - 100-110 / 210-260 - 150-200 / 260-360 - 200-300 / 460-560 - 400-500,170-180 - 110-120 / 220-270 - 160-210 / 270-370 - 210-310 / 470-570 - 410-510,180-190 - 120-130 / 230-280 - 170-220 / 280-380 - 220-320 / 480-580 - 420-520,190-200 - 130-140 / 240-290 - 180-230 / 290-390 - 230-330 / 490-590 - 430-530,200-210 - 140-150 / 250-300 - 190-240 / 300-400 - 240-340 / 500-600 - 440-540,210-220 - 150-160 / 260-310 - 200-250 / 310-410 - 250-350 / 510-610 - 450-550,220-230 - 160-170 / 270-320 - 210-260 / 320-420 - 260-360 / 520-620 - 460-560,230-240 - 170-180 / 280-330 - 220-270 / 330-430 - 270-370 / 530-630 - 470-570
#080,Slowbro,Yadoranヤドラン,Flagadoss,Lahmus,야도란,https://www.serebii.net/quest/pokemon/080.png,Water / Psychic,Hermit Crab Pokémon,Melee,"5'03"" / 1.6m",173.1lbs / 78.5kg,Evolves into pokemon #080 at level 37 / ,"Amnesia - Psychic Type - 0 power  - 8 sec. cooldown - The user temporarily empties its mind to forget its concerns, raising the amount of damage it deals and making it more resistant to negative effects. - Not Exclusive / Belly Drum - Normal Type - 0 power  - 5 sec. cooldown - The user uses its own HP to raise all of its stats for a while. - Not Exclusive / Growl - Normal Type - 0 power  - 4 sec. cooldown - The user growls in an endearing way, making surrounding enemies less wary and often reducing the amount of damage they deal. - Not Exclusive / Ice Punch - Ice Type - 175 power  - 5 sec. cooldown - The user chills its fist and unleashes a freezing punch on enemies directly in front of it. Sometimes freezes enemies. - Not Exclusive / Light Screen - Psychic Type - 0 power  - 3 sec. cooldown - The user creates a wall of light, making it harder for it to be affected by negative effects for a while. - Not Exclusive / Rest - Psychic Type - 0 power  - 9 sec. cooldown - The user rests in place, greatly restoring its HP. - Not Exclusive / Surf - Water Type - 127 power  - 5 sec. cooldown - The user creates a wide wave and charges forward on it. Deals damage to enemies caught in the wave. - Not Exclusive / Tackle - Normal Type - 163 power  - 5 sec. cooldown - The user smashes into enemies in front of itself with all its might, damaging them. - Not Exclusive / Withdraw - Water Type - 0 power  - 5 sec. cooldown - The user withdraws into its hard shell, reducing the amount of damage it takes for a while. - Not Exclusive / Zen Headbutt - Psychic Type - 370 power  - 5 sec. cooldown - The user focuses its willpower to its head, then smashes it into enemies directly in front of itself, dealing damage to enemies hit by it. - Not Exclusive / ",-25% Taking Critical Hits Rate / -25% Taking Critical Hits Rate / -50% Taking Critical Hits Rate,+20% Healing per Wave / +100% Resistant to Confused / +30% Healing per Wave,-10% Time to Recover / +10% HP upon Recovery / -15% Time to Recover,650,150,64.29,30.95,4.76,651-661 - 151-161 / 701-751 - 201-251 / 751-851 - 251-351 / 951-1051 - 451-551,660-670 - 160-170 / 710-760 - 210-260 / 760-860 - 260-360 / 960-1060 - 460-560,670-680 - 170-180 / 720-770 - 220-270 / 770-870 - 270-370 / 970-1070 - 470-570,680-690 - 180-190 / 730-780 - 230-280 / 780-880 - 280-380 / 980-1080 - 480-580,690-700 - 190-200 / 740-790 - 240-290 / 790-890 - 290-390 / 990-1090 - 490-590,700-710 - 200-210 / 750-800 - 250-300 / 800-900 - 300-400 / 1000-1100 - 500-600,710-720 - 210-220 / 760-810 - 260-310 / 810-910 - 310-410 / 1010-1110 - 510-610,720-730 - 220-230 / 770-820 - 270-320 / 820-920 - 320-420 / 1020-1120 - 520-620,730-740 - 230-240 / 780-830 - 280-330 / 830-930 - 330-430 / 1030-1130 - 530-630,740-750 - 240-250 / 790-840 - 290-340 / 840-940 - 340-440 / 1040-1140 - 540-640,750-760 - 250-260 / 800-850 - 300-350 / 850-950 - 350-450 / 1050-1150 - 550-650
#081,Magnemite,Coilコイル,Magnéti,Magnetilo,코일,https://www.serebii.net/quest/pokemon/081.png,Electric / Steel,Magnet Pokémon,Range,"1'00"" / 0.3m",13.2lbs / 6kg,Evolves into pokemon #082 at level 30 / ,"Charge - Electric Type - 0 power  - 9 sec. cooldown - The user stores up electricity, raising the damage it deals and making it resistant to negative effects for a while. - Not Exclusive / Electroweb - Electric Type - 0 power  - 2 sec. cooldown - The user spreads an electric net out directly in front of itself, lowering the movement speed of enemies hit by it for a while. - Not Exclusive / Flash Cannon - Steel Type - 170 power  - 7 sec. cooldown - The user focuses all of its light energy into a single point and fires a beam in front of itself, sometimes raising the amount of damage enemies take. - Not Exclusive / Metal Sound - Steel Type - 0 power  - 3 sec. cooldown - Enemies near the user are forced to listen to a horrible sound like metal scraping, often raising the amount of damage they take. - Not Exclusive / Supersonic - Normal Type - 0 power  - 3 sec. cooldown - The user generates odd sound waves from its body, often confusing surrounding enemies. - Not Exclusive / ",+5% ATK of Electric-Type Moves / +15% ATK of Electric-Type Moves / +500 ATK,-10% Steel-Type Moves Wait / +100% Resistant to Poisoned / +100% Resistant to Paralyzed,-5% Electric-Type Moves Wait / -15% Electric-Type Moves Wait / -15% Steel-Type Moves Wait,80,120,38.1,57.14,4.76,81-91 - 121-131 / 131-181 - 171-221 / 181-281 - 221-321 / 381-481 - 421-521,90-100 - 130-140 / 140-190 - 180-230 / 190-290 - 230-330 / 390-490 - 430-530,100-110 - 140-150 / 150-200 - 190-240 / 200-300 - 240-340 / 400-500 - 440-540,110-120 - 150-160 / 160-210 - 200-250 / 210-310 - 250-350 / 410-510 - 450-550,120-130 - 160-170 / 170-220 - 210-260 / 220-320 - 260-360 / 420-520 - 460-560,130-140 - 170-180 / 180-230 - 220-270 / 230-330 - 270-370 / 430-530 - 470-570,140-150 - 180-190 / 190-240 - 230-280 / 240-340 - 280-380 / 440-540 - 480-580,150-160 - 190-200 / 200-250 - 240-290 / 250-350 - 290-390 / 450-550 - 490-590,160-170 - 200-210 / 210-260 - 250-300 / 260-360 - 300-400 / 460-560 - 500-600,170-180 - 210-220 / 220-270 - 260-310 / 270-370 - 310-410 / 470-570 - 510-610,180-190 - 220-230 / 230-280 - 270-320 / 280-380 - 320-420 / 480-580 - 520-620
#082,Magneton,Rarecoilレアコイル,Magnéton,Magneton,레어코일,https://www.serebii.net/quest/pokemon/082.png,Electric / Steel,Magnet Pokémon,Range,"3'03"" / 1m",132.3lbs / 60kg,Evolves into pokemon #082 at level 30 / ,"Charge - Electric Type - 0 power  - 9 sec. cooldown - The user stores up electricity, raising the damage it deals and making it resistant to negative effects for a while. - Not Exclusive / Electric Terrain - Electric Type - 0 power  - 5 sec. cooldown - The user gathers electrical power beneath itself, raising the damage it deals for a while. - Not Exclusive / Electroweb - Electric Type - 0 power  - 2 sec. cooldown - The user spreads an electric net out directly in front of itself, lowering the movement speed of enemies hit by it for a while. - Not Exclusive / Explosion - Normal Type - 683 power  - 5 sec. cooldown - The user causes a tremendous explosion, dealing huge damage to surrounding enemies. The trade-off is that the user takes enough damage to knock itself out. - Not Exclusive / Flash Cannon - Steel Type - 170 power  - 7 sec. cooldown - The user focuses all of its light energy into a single point and fires a beam in front of itself, sometimes raising the amount of damage enemies take. - Not Exclusive / Light Screen - Psychic Type - 0 power  - 3 sec. cooldown - The user creates a wall of light, making it harder for it to be affected by negative effects for a while. - Not Exclusive / Metal Sound - Steel Type - 0 power  - 3 sec. cooldown - Enemies near the user are forced to listen to a horrible sound like metal scraping, often raising the amount of damage they take. - Not Exclusive / Supersonic - Normal Type - 0 power  - 3 sec. cooldown - The user generates odd sound waves from its body, often confusing surrounding enemies. - Not Exclusive / Thunder - Electric Type - 204 power  - 5 sec. cooldown - The user strikes the area in front of itself with a lightning bolt. Deals damage to nearby enemies. Sometimes paralyzes enemies. - Not Exclusive / Thunderbolt - Electric Type - 80 power  - 5 sec. cooldown - The user discharges tremendous electricity all around itself. Deals damage to enemies around the user. Sometimes paralyzes enemies. - Not Exclusive / ",+5% ATK of Electric-Type Moves / +10% ATK of Electric-Type Moves / +30% ATK of Electric-Type Moves,-10% Steel-Type Moves Wait / +100% Resistant to Poisoned / +100% Resistant to Paralyzed,-5% Electric-Type Moves Wait / -10% Electric-Type Moves Wait / -20% Normal-Type Moves Wait,300,400,38.1,57.14,4.76,301-311 - 401-411 / 351-401 - 451-501 / 401-501 - 501-601 / 601-701 - 701-801,310-320 - 410-420 / 360-410 - 460-510 / 410-510 - 510-610 / 610-710 - 710-810,320-330 - 420-430 / 370-420 - 470-520 / 420-520 - 520-620 / 620-720 - 720-820,330-340 - 430-440 / 380-430 - 480-530 / 430-530 - 530-630 / 630-730 - 730-830,340-350 - 440-450 / 390-440 - 490-540 / 440-540 - 540-640 / 640-740 - 740-840,350-360 - 450-460 / 400-450 - 500-550 / 450-550 - 550-650 / 650-750 - 750-850,360-370 - 460-470 / 410-460 - 510-560 / 460-560 - 560-660 / 660-760 - 760-860,370-380 - 470-480 / 420-470 - 520-570 / 470-570 - 570-670 / 670-770 - 770-870,380-390 - 480-490 / 430-480 - 530-580 / 480-580 - 580-680 / 680-780 - 780-880,390-400 - 490-500 / 440-490 - 540-590 / 490-590 - 590-690 / 690-790 - 790-890,400-410 - 500-510 / 450-500 - 550-600 / 500-600 - 600-700 / 700-800 - 800-900
